movieId,title,imdb_url,adult,overview,runtime,status,tagline,facebook,instagram,twitter,tmdb_id
29661,THE WILD ROBOT (ENGLISH) (U),https://www.imdb.com/title/tt29623480,False,"A robot — ROZZUM unit 7134, “Roz” for short — is shipwrecked on an uninhabited island and must learn to adapt to the harsh surroundings, gradually building relationships with the animals on the island and becoming the adoptive parent of an orphaned gosling.",,In Production,Discover your true nature.,https://www.facebook.com/dreamworksthewildrobot,https://www.facebook.com/thewildrobot,,1184918
28535,JIGRA (TELUGU) (U/A),https://www.imdb.com/title/tt26733317,False,"A series of unfortunate events leads to a sister setting out on a journey of excruciating pain, vigour and a will that cannot be bent until her brother is free.",,Post Production,"""Tu meri protection mein hai""",,,,1184889
30881,DHRUVA SARJA MARTIN (TAMIL) (U/A),,False,,,Post Production,,,,,861451
31371,BOUGAINVILLEA (MALAYALAM) (U/A),https://www.imdb.com/title/tt32592802,False,"A gripping psychological thriller that follows a family entangled in a police investigation surrounding the mysterious disappearance of tourists in Kerala. Set against a backdrop of picturesque landscapes, the investigation slowly unravels secrets, casting suspicion on the family and blurring the lines between truth and deception",160,Post Production,,,,,1177224
29868,VICKY VIDYA KA WOH WALA VIDEO,https://www.imdb.com/title/tt29330913,False,It revolves around the pandemonium in a small town when a VHS tape containing an intimate video of Vicky and Vidya is leaked.,,In Production,,,,,1213712
28577,DEVARA (PART-1),https://www.imdb.com/title/tt11821912,False,"Set in a coastal region, a fearless man named Devara ventures into the treacherous world of the sea to protect the lives of his people. Unaware of his brother Bhaira's conspiracy, he ultimately passes on his legacy to his mild-mannered son Varada.",175,Post Production,When courage turns into a disease... Fear is the only cure,,https://www.facebook.com/devaramovie,https://www.twitter.com/DevaraMovie,811941
29981,SMILE 2 (ENGLISH) (T.B.A),https://www.imdb.com/title/tt29268110,False,"About to embark on a new world tour, global pop sensation Skye Riley begins experiencing increasingly terrifying and inexplicable events. Overwhelmed by the escalating horrors and the pressures of fame, Skye is forced to face her dark past to regain control of her life before it spirals out of control.",,Post Production,It will never let go.,https://www.facebook.com/SmileMovie,https://www.facebook.com/smilemovie,https://www.twitter.com/SmileMovie,1100782
31448,VISWAM (TELUGU WITH ENGLISH SUBTITLE) (U/A),https://www.imdb.com/title/tt28630710,False,"Viswam is a Telugu movie starring Tottempudi Gopichand and Kavya Thapar in prominent roles. It is directed by Sreenu Vaitla.

",,Released,,,,,1273448
30954,GOODRICH,https://www.imdb.com/title/tt10171472,False,"A father seeks the help of his adult daughter to raise his young twins after his second wife leaves him.

",,Post Production,,,,,1088096
31435,BLACK (TAMIL) (U/A),,False,,,Released,,,,,1340332
29578,LUBBER PANDHU,https://www.imdb.com/title/tt27007466,False,,,Post Production,,,,,1097000
31357,BOHURUPI,https://www.imdb.com/title/tt32857110,False,A mysterious dacoit is on the run. A supercop gets involved with him in a cat and mouse chase. A Puja release by Nandita Roy and Shiboprosad Mukherjee.,,Post Production,,,,,1257622
28531,JOKER FOLIE A DEUX,https://www.imdb.com/title/tt11315808,False,"Failed comedian Arthur Fleck meets the love of his life, Harley Quinn, while incarcerated at Arkham State Hospital. Upon his release, the two of them embark on a doomed romantic misadventure.",,Post Production,The world is a stage.,https://www.facebook.com/jokermovie,https://www.facebook.com/jokermovie,https://www.twitter.com/jokermovie,889737
29662,TRANSFORMERS ONE,https://www.imdb.com/title/tt8864596,False,"The untold origin story of Optimus Prime and Megatron, better known as sworn enemies, but once were friends bonded like brothers who changed the fate of Cybertron forever.",90,Post Production,Witness the origin.,https://www.facebook.com/transformersmovie,https://www.facebook.com/transformersmovie,https://www.twitter.com/transformers,698687
29663,STREE 2 SARKATE KA AATANK,https://www.imdb.com/title/tt27510174,False,"A hollow headless creature 'Sarkata' is spreading terror in the sleepy small town of Chanderi. The trio of Vicky, Jana and Bittu, along with the wise man Rudra summon 'Stree', who has her own secrets, to save them and the town from the new monster.",,Post Production,Sarkatein Ka Aatank,,,,1112426
31387,SWAG (TELUGU) (T.B.A),,False,"SWAG is a Telugu movie starring Sree Vishnu, Ritu Varma, Meera Jasmine and Daksha Nagarkar in prominent roles. It is written and directed by Hasith Goli.

",,Released,Swagika Vamshaniki Swagatham,,,,1252542
29945,TEKKA,,False,,,In Production,,,,,1126365
31123,THE APPRENTICE (ENGLISH) (A),https://www.imdb.com/title/tt8368368,False,"A young Donald Trump, eager to make his name as a hungry scion of a wealthy family in 1970s New York, comes under the spell of Roy Cohn, the cutthroat attorney who would help create the Donald Trump we know today. Cohn sees in Trump the perfect protégé—someone with raw ambition, a hunger for success, and a willingness to do whatever it takes to win.",120,Released,,,,,1182047
31115,JANAKA AYITHE GANAKA (TELUGU) (U/A),https://www.imdb.com/title/tt32843331,False,"Janaka Aithe Ganaka is a Telugu movie starring Suhas, Sangeerthana, Venalla Kishore and Rajendra Prasad in prominent roles. It is written and directed by Sandeep Reddy Bandla.

",133,Post Production,,,,,1357662
31140,KISHKINDHA KANDAM,https://www.imdb.com/title/tt15980138,False,"Bizarre occurrences in a monkey-inhabited village drive a newlywed couple and forest officials to seek answers behind the strange events.

",125,Released,A Tale Of Three Wise Monkeys,,,,1025125
31113,IBBANI TABBIDA ILEYALI,https://www.imdb.com/title/tt26738153,False,"What defines love? Memories that you can fondly look at? Tomorrow's dream of togetherness? Or the longing after separation?  Ibbani Tabbida Ileyali is a poetic tale of romance that intends to celebrate unconditional love. An attempt to capture the essence of yesterday's romance, the relevance of today's and the perpetual nature of it that can stand the test of the future!  We aspire to make you sing, smile, dance and savour the sweet melancholy. A story that spans a decade encapsulating the days of college, career aspirations and adulthood! Urban cityscape, the greens and more importantly the dreamy atmospherics. There's a scent of summer, the warmth of winter and the melody of monsoon!",,Released,,,,,1014795
31451,MAA NANNA SUPER HERO (TELUGU) (U),https://www.imdb.com/title/tt28115572,False,"A soul-stirring journey, discovering the true meaning of love and connection.",,Released,,,,,1357414
20880,TUMBBAD (RE RELEASE),https://www.imdb.com/title/tt8239946,False,"India, 1918. On the outskirts of Tumbbad, a cursed village where it always rains, Vinayak, along with his mother and his brother, care of a mysterious old woman who keeps the secret of an ancestral treasure that Vinayak gets obsessed with.",113,Released,A Tale of Greed Beyond Fear,,,,538858
31429,SUPER MAN THE CHRISTOPHER REEVE STORY (ENGLISH),https://www.imdb.com/title/tt27902121,False,"The story of Christopher Reeve is an astonishing rise from unknown actor to iconic movie star, and his definitive portrayal of Clark Kent/Superman set the benchmark for the superhero cinematic universes that dominate cinema today. Reeve portrayed the Man of Steel in four Superman films and played dozens of other roles that displayed his talent and range as an actor, before being injured in a near-fatal horse-riding accident in 1995 that left him paralyzed from the neck down. After becoming a quadriplegic, he became a charismatic leader and activist in the quest to find a cure for spinal cord injuries, as well as a passionate advocate for disability rights and care - all while continuing his career in cinema in front of and behind the camera and dedicating himself to his beloved family.

",104,Released,"Husband. Father. Fighter. Hero. Once you choose hope, anything is possible.",,,,1128559
28550,DESPICABLE ME 4,https://www.imdb.com/title/tt7510222,False,"Gru and Lucy and their girls — Margo, Edith and Agnes — welcome a new member to the Gru family, Gru Jr., who is intent on tormenting his dad. Gru faces a new nemesis in Maxime Le Mal and his femme fatale girlfriend Valentina, and the family is forced to go on the run.",95,Post Production,Things just got a little more despicable.,https://www.facebook.com/minions,https://www.facebook.com/minions,https://www.twitter.com/Minions,519182
30746,MEIYAZHAGAN,https://www.imdb.com/title/tt26758372,False,,,In Production,,,,,1136423
30853,KRISHNAM PRANAYA SAKHI,,False,"A wealthy tycoon's son becomes a valet to win the heart of a girl from a humble background. Determined to marry her, he faces challenges in gaining approval from her parents.",161,Released,Love finds it's way.,,,,1330592
22329,VEER ZAARA (RE RELEASE),https://www.imdb.com/title/tt0420332,False,"Squadron Leader Veer Pratap Singh, a pilot in the Indian Air Force, rescues the stranded Zaara, a woman from Pakistan, following a bus accident, and their lives are forever bound.",192,Released,A Love Legend,,,,4251
31425,PHULLWANTI (MARATHI) (U),https://www.imdb.com/title/tt32339951,False,"An esteemed, prestigious court dancer is challenged by the holistic views of society as she is seen as an impure woman who just entertains, but the dancer decides to go against the grain and prove to the people that it's their view what's impure, not her.",,Post Production,,,,,1360431
29943,KHEL KHEL MEIN,https://www.imdb.com/title/tt27056012,False,The story revolves around a group of friends who gather for a dinner and end up revealing secrets about each other. Khel Khel Mein is the official remake of 2016's Italian comedy thriller film 'Perfect Strangers',,Planned,,,,,1241592
28539,SPEAK NO EVIL,https://www.imdb.com/title/tt27534307,False,"When an American family is invited to spend the weekend at the idyllic country estate of a charming British family they befriended on vacation, what begins as a dream holiday soon warps into a snarled psychological nightmare.",,Post Production,,https://www.facebook.com/speaknoevilthefilm,https://www.facebook.com/speaknoevilthemovie,https://www.twitter.com/speaknoevil24,1114513
28691,IT ENDS WITH US,https://www.imdb.com/title/tt10655524,False,"Though coming from a complicated past, Lily Bloom has always known the life she wants. While living in Boston, she meets neurosurgeon Ryle Kincaid and believes she may very well have found her soul mate. Soon, however, questions arise about their relationship, and to complicate matters, her high school love interest, Atlas Corrigan, comes back into the picture, putting her relationship with Ryle in jeopardy.",,In Production,,,,https://www.twitter.com/ItEndsWithUs,1079091
28744,THE BUCKINGHAM MURDERS,https://www.imdb.com/title/tt15245240,False,"Fresh wounds are reopened when Jasmeet Bhamra, a cop and a single mother who recently lost her child in a shooting spree, transfers to High Wycombe and is assigned a case of a missing child.",110,Released,,,,,1053348
